{
  "width":  5,
  "height": 5,
  "bgColor": 16777215,
  "highlightBgColor": 16777215,
  "highlightFgColor": 0,
  "blocks": [
    {
      "id": 0,
      "x": 0, "y": 0,
      "width": 2, "height": 1,
      "depth": 0, "color": 13421772,
      "edgeEnds": [
        0,
        1
      ]
    },
    {
      "id": 1,
      "x": 0, "y": 4,
      "width": 2, "height": 1,
      "depth": 0, "color": 13421772,
      "edgeEnds": [
        2,
        3
      ]
    },
    {
      "id": 2,
      "x": 3, "y": 4,
      "width": 1, "height": 1,
      "depth": 0, "color": 13421772,
      "edgeEnds": [
        4
      ]
    },
    {
      "id": 3,
      "x": 3, "y": 0,
      "width": 1, "height": 1,
      "depth": 0, "color": 13421772,
      "edgeEnds": [
      ]
    }
  ],
  "edgeEnds": [
    {
      "id": 0,
      "x": 0, "y": 1,
      "color": 0,
      "direction": 3,
      "isSource": true,
      "block": 0,
      "edgeEnds": [
        2,
        3,
        4
      ]
    },
    {
      "id": 1,
      "x": 1, "y": 1,
      "color": 0,
      "direction": 3,
      "isSource": true,
      "block": 0,
      "edgeEnds": [
        2,
        3
      ]
    },
    {
      "id": 2,
      "x": 0, "y": 3,
      "color": 0,
      "direction": 3,
      "isSource": false,
      "block": 1,
      "edgeEnds": [
        0,
        1
      ]
    },
    {
      "id": 3,
      "x": 1, "y": 3,
      "color": 0,
      "direction": 3,
      "isSource": false,
      "block": 1,
      "edgeEnds": [
        0,
        1
      ]
    },
    {
      "id": 4,
      "x": 3, "y": 3,
      "color": 0,
      "direction": 3,
      "isSource": false,
      "block": 2,
      "edgeEnds": [
        0
      ]
    },
    {
      "id": 5,
      "x": 4, "y": 1,
      "color": 0,
      "direction": 3,
      "isSource": true,
      "block": null,
      "edgeEnds": [
        6
      ]
    },
    {
      "id": 6,
      "x": 4, "y": 2,
      "color": 0,
      "direction": 3,
      "isSource": false,
      "block": null,
      "edgeEnds": [
        5
      ]
    }
  ]
}
