{
    "width":  4,
    "height": 4,
    "bgColor": 1,
    "highlightBgColor": 2,
    "highlightFgColor": 3,
    "blocks": [
        {
            "id": 0,
            "x": 0, "y": 0,
            "width": 2, "height": 1,
            "depth": 0, "color": 4,
            "edgeEnds": [
                0,
                100
            ]
        }
    ],
    "edgeEnds": [
        {
            "id": 0,
            "x": 0, "y": 1,
			"color": 5,
            "direction": 3,
            "isSource": true,
            "block": 0,
            "edgeEnds": [
                1
            ]
        },
        {
            "id": 100,
            "x": 1, "y": 1,
			"color": 6,
            "direction": 1,
            "isSource": false,
            "block": 0,
            "edgeEnds": [
                0
            ]
        }
    ]
}
